{
  "schema_version": 1,
  "target_kind": "unpromoted_encounter_room_subset",
  "target_name": "core-dev-encounter-rooms",
  "required_normal_enemy_ids": [
    "enemy.drowned_pilgrim", "enemy.mire_leech", "enemy.bell_reed",
    "enemy.bell_acolyte", "enemy.chain_sentry", "enemy.choir_skull"
  ],
  "required_miniboss_ids": ["miniboss.sepulcher_knight", "miniboss.choir_abbot"],
  "required_pattern_ids": [
    "pattern.enemy.drowned_pilgrim.fan", "pattern.enemy.mire_leech.charge",
    "pattern.enemy.bell_reed.gap_ring", "pattern.enemy.bell_acolyte.alternating_fan",
    "pattern.enemy.chain_sentry.cross_lanes", "pattern.enemy.choir_skull.rotor",
    "miniboss.sepulcher_knight.charge_lane", "miniboss.sepulcher_knight.stop_ring",
    "miniboss.sepulcher_knight.shield_fan", "miniboss.choir_abbot.rotor",
    "miniboss.choir_abbot.recovery_ring"
  ],
  "required_room_template_ids": [
    "room.bell.vestibule_01", "room.bell.cross_01", "room.bell.nave_01",
    "room.bell.bridge_01", "room.bell.choir_01", "room.bell.knight_01",
    "room.bell.rest_01", "room.bell.secret_01", "arena.boss.caldus_01"
  ],
  "required_pack_ids": ["pack.bell.01"],
  "required_layout_ids": ["layout.core_private_life_01"],
  "required_asset_ids": [
    "sprite.enemy.drowned_pilgrim", "portrait.enemy.drowned_pilgrim",
    "sprite.enemy.mire_leech", "portrait.enemy.mire_leech",
    "sprite.enemy.bell_reed", "portrait.enemy.bell_reed",
    "sprite.enemy.bell_acolyte", "portrait.enemy.bell_acolyte",
    "sprite.enemy.chain_sentry", "portrait.enemy.chain_sentry",
    "sprite.enemy.choir_skull", "portrait.enemy.choir_skull",
    "sprite.miniboss.sepulcher_knight", "portrait.miniboss.sepulcher_knight",
    "sprite.miniboss.choir_abbot", "portrait.miniboss.choir_abbot",
    "tilemap.room.bell.vestibule_01", "tilemap.room.bell.cross_01",
    "tilemap.room.bell.nave_01", "tilemap.room.bell.bridge_01",
    "tilemap.room.bell.choir_01", "tilemap.room.bell.knight_01",
    "tilemap.room.bell.rest_01", "tilemap.room.bell.secret_01",
    "tilemap.arena.boss.caldus_01",
    "pattern.enemy.drowned_pilgrim.fan.telegraph", "pattern.enemy.drowned_pilgrim.fan.warning",
    "pattern.enemy.mire_leech.charge.telegraph", "pattern.enemy.mire_leech.charge.warning",
    "pattern.enemy.bell_reed.gap_ring.telegraph", "pattern.enemy.bell_reed.gap_ring.warning",
    "pattern.enemy.bell_acolyte.alternating_fan.telegraph", "pattern.enemy.bell_acolyte.alternating_fan.warning",
    "pattern.enemy.chain_sentry.cross_lanes.telegraph", "pattern.enemy.chain_sentry.cross_lanes.warning",
    "pattern.enemy.choir_skull.rotor.telegraph", "pattern.enemy.choir_skull.rotor.warning",
    "miniboss.sepulcher_knight.charge_lane.telegraph", "miniboss.sepulcher_knight.charge_lane.warning", "miniboss.sepulcher_knight.charge_lane.warning.major",
    "miniboss.sepulcher_knight.stop_ring.telegraph", "miniboss.sepulcher_knight.stop_ring.warning",
    "miniboss.sepulcher_knight.shield_fan.telegraph", "miniboss.sepulcher_knight.shield_fan.warning",
    "miniboss.choir_abbot.rotor.telegraph", "miniboss.choir_abbot.rotor.warning",
    "miniboss.choir_abbot.recovery_ring.telegraph", "miniboss.choir_abbot.recovery_ring.warning", "miniboss.choir_abbot.recovery_ring.warning.major"
  ],
  "required_localization_keys": [
    "enemy.drowned_pilgrim.name", "enemy.drowned_pilgrim.description",
    "enemy.mire_leech.name", "enemy.mire_leech.description",
    "enemy.bell_reed.name", "enemy.bell_reed.description",
    "enemy.bell_acolyte.name", "enemy.bell_acolyte.description",
    "enemy.chain_sentry.name", "enemy.chain_sentry.description",
    "enemy.choir_skull.name", "enemy.choir_skull.description",
    "miniboss.sepulcher_knight.name", "miniboss.sepulcher_knight.description",
    "miniboss.choir_abbot.name", "miniboss.choir_abbot.description",
    "room.bell.vestibule_01.name", "room.bell.vestibule_01.description",
    "room.bell.cross_01.name", "room.bell.cross_01.description",
    "room.bell.nave_01.name", "room.bell.nave_01.description",
    "room.bell.bridge_01.name", "room.bell.bridge_01.description",
    "room.bell.choir_01.name", "room.bell.choir_01.description",
    "room.bell.knight_01.name", "room.bell.knight_01.description",
    "room.bell.rest_01.name", "room.bell.rest_01.description",
    "room.bell.secret_01.name", "room.bell.secret_01.description",
    "arena.boss.caldus_01.name", "arena.boss.caldus_01.description",
    "pack.bell.01.name", "pack.bell.01.description",
    "layout.core_private_life_01.name", "layout.core_private_life_01.description"
  ],
  "expected_records_blake3": "2511ee54b27d3270f077da52919144fae72751a0aa700bf2b39cd3bba5f03554",
  "expected_assets_blake3": "5c812601bc15317d96a7ea978b3f734570976fb37cfc724d3e24b168937d3bd8",
  "expected_localization_blake3": "a84a300b67f95e886f4c1046a46dd25121c80f883836181fd8340d0a1ec2c6b1"
}
